id,question,choice1,choice2,choice3,solution
1,"Acetazolamide (Ace) is a putative inhibitor of carbonic anhydrase (CA), an enzyme that catalyzes the equilibration of carbon dioxide and carbonic acid and plays a key role in HCO(3)(-) and water reabsorption and acid secretion.",positive,neutral,negative,neutral
2,"(123)iodine labelled beta-methyl-iodophenyl pentadecanoic acid myocardial single photon emission computed tomography showed decreased uptake of the inferior segment in the early image, whereas the delayed images revealed significant fill-in of the tracer in the inferior segment of the myocardium.",positive,neutral,negative,neutral
3,"2-Phenylethanol is a widely used aroma compound with rose-like fragrance and L-homophenylalanine is a building block of angiotensin-converting enzyme (ACE) inhibitor.",positive,neutral,negative,positive
4,"3,4-dihydroxyphenylacetic acid and 4-methylcatechol (urinary metabolites of flavonoids) also inhibited both APN and ACE activity, but not NEP activity.",positive,neutral,negative,positive
5,"You chose 'Neutral'. Other players selected the classification shown below. You have the option to change your answer before proceeding.",positive,neutral,negative,positive
